{
  "$schema": "https://json-schema.org/draft/2020-12/schema",
  "$id": "https://itdo.jp/schemas/private-match/assurance/public-release-output-set.v0.1.schema.json",
  "title": "Exact public release output set v0.1",
  "type": "object",
  "additionalProperties": false,
  "required": [
    "schema_version",
    "artifact_status",
    "bundle_id",
    "release_id",
    "exact_paths",
    "files",
    "self",
    "bundle_tree_digest",
    "manifest_digest",
    "release_signature_digest",
    "static_report_model_digest",
    "output_set_digest"
  ],
  "properties": {
    "schema_version": {
      "const": "0.1"
    },
    "artifact_status": {
      "const": "test-only"
    },
    "bundle_id": {
      "type": "string",
      "minLength": 1
    },
    "release_id": {
      "type": "string",
      "minLength": 1
    },
    "exact_paths": {
      "type": "array",
      "items": {
        "type": "string",
        "pattern": "^(?!/)(?![A-Za-z]:)(?!.*\\\\\\\\)(?!.*(?:^|/)\\.\\.?/)(?!.*//)[A-Za-z0-9._/-]+$"
      },
      "minItems": 1,
      "uniqueItems": true
    },
    "files": {
      "type": "array",
      "items": {
        "type": "object",
        "additionalProperties": false,
        "required": [
          "path",
          "file_digest",
          "size",
          "role"
        ],
        "properties": {
          "path": {
            "type": "string",
            "pattern": "^(?!/)(?![A-Za-z]:)(?!.*\\\\\\\\)(?!.*(?:^|/)\\.\\.?/)(?!.*//)[A-Za-z0-9._/-]+$"
          },
          "file_digest": {
            "type": "string",
            "pattern": "^sha256:[0-9a-f]{64}$"
          },
          "size": {
            "type": "integer",
            "minimum": 1,
            "maximum": 8388608
          },
          "role": {
            "type": "string",
            "minLength": 1
          }
        }
      },
      "minItems": 1
    },
    "self": {
      "type": "object",
      "additionalProperties": false,
      "required": [
        "path",
        "digest_field"
      ],
      "properties": {
        "path": {
          "const": "public-release-output-set.v0.1.json"
        },
        "digest_field": {
          "const": "output_set_digest"
        }
      }
    },
    "bundle_tree_digest": {
      "type": "string",
      "pattern": "^sha256:[0-9a-f]{64}$"
    },
    "manifest_digest": {
      "type": "string",
      "pattern": "^sha256:[0-9a-f]{64}$"
    },
    "release_signature_digest": {
      "type": "string",
      "pattern": "^sha256:[0-9a-f]{64}$"
    },
    "static_report_model_digest": {
      "type": "string",
      "pattern": "^sha256:[0-9a-f]{64}$"
    },
    "output_set_digest": {
      "type": "string",
      "pattern": "^sha256:[0-9a-f]{64}$"
    }
  }
}
