{"artifact_status":"test-only","bundle_id":"PMA-PUBLIC-RELEASE-FIXTURE-V0-1","bundle_tree_digest":"sha256:97e91d5097ab6e3f135e27ab3f349ce07a806d8287ad2363d114bd5685a8368f","exact_paths":["artifacts/build-provenance.v0.1.json","artifacts/fixture-release-artifact.json","artifacts/sbom.cdx.json","manifest/public-release-bundle-manifest.v0.1.json","public-release-output-set.v0.1.json","records/assumptions/pm-assumption-6001.json","records/claims/pm-claim-6001.json","records/claims/pm-claim-6002.json","records/claims/pm-claim-6003.json","records/claims/pm-claim-6004.json","records/evidence/pm-evidence-6001.json","records/evidence/pm-evidence-6002.json","records/evidence/pm-evidence-6003.json","records/evidence/pm-evidence-6004.json","records/limitations/pm-limitation-6001.json","records/limitations/pm-limitation-6002.json","reports/public-release-content-report.v0.1.json","reports/public-release-content-report.v0.1.md","signatures/public-release-manifest.dsse.v0.1.json"],"files":[{"file_digest":"sha256:df3f8b457f066a1ff19f27105901c8aecd69d32625a1cdf691e7dabf2fe321a9","path":"artifacts/build-provenance.v0.1.json","role":"release-artifact","size":986},{"file_digest":"sha256:dd105fded85a3242a4300bd23b309d123bf152c69ab210b653834a268fc8484b","path":"artifacts/fixture-release-artifact.json","role":"release-artifact","size":482},{"file_digest":"sha256:84b97ef07a8c89f2432027934db77533dccd372d7ff94d0e19fd4315f5737d0e","path":"artifacts/sbom.cdx.json","role":"release-artifact","size":787},{"file_digest":"sha256:8d359a6ae487c897809a7ac364a854f523f1893abb23e1022011591cd37bfa3c","path":"manifest/public-release-bundle-manifest.v0.1.json","role":"release-manifest","size":7631},{"file_digest":"sha256:c71585c30e7c398f72b4bb0389bf5b809270348fd4b96de088737fd3e83483a5","path":"records/assumptions/pm-assumption-6001.json","role":"release-record","size":593},{"file_digest":"sha256:77e8635b574375f8578fca4f028f0fde1efa7916dfa35dc609b6d463d5a27890","path":"records/claims/pm-claim-6001.json","role":"release-record","size":748},{"file_digest":"sha256:cc84c4064526a7cc2f8185f7ed310e5c1b133fa01fc6261bb53473ffe883f643","path":"records/claims/pm-claim-6002.json","role":"release-record","size":779},{"file_digest":"sha256:e301bcde4f67924dbbc5c51546bd307ef434f6fe8d10c7bf2c875281baeb2a10","path":"records/claims/pm-claim-6003.json","role":"release-record","size":782},{"file_digest":"sha256:fbe921146e7e6fc8fc7edc8482b6dc3210396ec7413054d799301af4e9f5cd84","path":"records/claims/pm-claim-6004.json","role":"release-record","size":719},{"file_digest":"sha256:9ce4681ddc579fb269a251bb4427c43f5372a91c7bff564507c6bb221487078c","path":"records/evidence/pm-evidence-6001.json","role":"release-record","size":1542},{"file_digest":"sha256:461b88dd144e3bf0c34d546dd7a60ce8325fa8552b453d970af319b082f28a93","path":"records/evidence/pm-evidence-6002.json","role":"release-record","size":1626},{"file_digest":"sha256:e1c10b62ebc5d85714508ca4256df59e7128499a3ac51d038955c58efcfad4e1","path":"records/evidence/pm-evidence-6003.json","role":"release-record","size":1536},{"file_digest":"sha256:4cc1a39e76affcbf4c23d9babae1124d6e75c6675e95a1298035b8e3d9351ad1","path":"records/evidence/pm-evidence-6004.json","role":"release-record","size":1501},{"file_digest":"sha256:542db89b80f4bdeee63eed6b24b5e330d81a28e83985f7c2a81338aaa89df60c","path":"records/limitations/pm-limitation-6001.json","role":"release-record","size":587},{"file_digest":"sha256:8346fdc83299dfbebb9e70f6dbf7c6ea5e9648227f13696345c7ce20b7c1d62f","path":"records/limitations/pm-limitation-6002.json","role":"release-record","size":573},{"file_digest":"sha256:4dd20490c3581a0ca5cc0a62932642866fc9e5ec41802180f5874c34005ccde9","path":"reports/public-release-content-report.v0.1.json","role":"release-content-report-json","size":4502},{"file_digest":"sha256:5cb564585a86f1cdd392e6447ab45b5a7b9561174c8104c9c0742c48b414da4d","path":"reports/public-release-content-report.v0.1.md","role":"release-content-report-markdown","size":2216},{"file_digest":"sha256:617fca97115ac63c0245f976d9df8b77d433f49d5cb1662625c0aba16141c660","path":"signatures/public-release-manifest.dsse.v0.1.json","role":"release-signature","size":10583}],"manifest_digest":"sha256:c76653233aadae34f895349545d41b499a0e8f37474436642f2cafaf51473d4c","output_set_digest":"sha256:14fc6a589db8ddb05389d14a6151f7252f277fb428778a78e16a82ff37e2c9fb","release_id":"private-match-assurance-fixture-release-0.1.0","release_signature_digest":"sha256:617fca97115ac63c0245f976d9df8b77d433f49d5cb1662625c0aba16141c660","schema_version":"0.1","self":{"digest_field":"output_set_digest","path":"public-release-output-set.v0.1.json"},"static_report_model_digest":"sha256:1888c75ac96cbedbffa32cc04ec83096ec48e61b3e9cf3c081a17b158c662e48"}